{
  "scenario_name": "policy_automatic_sunset",
  "description": "Illustrative governance overlay representing automatic expiration pressure on emergency authority in the same broad crisis frame.",
  "seed": 20260421,
  "peak_stress": 0.7999721678974817,
  "archetype": "rapid_shock_plateau",
  "regime": "",
  "governance_profile": {
    "platform_dependency": 0.59
  },
  "core": {
    "intelligence_reliability_gap": 0.805,
    "info_distortion": 0.752,
    "intelligence_contamination": 0.701,
    "negotiation_credibility": 0.338,
    "congressional_constraint": 0.485,
    "legal_cohesion": 0.56,
    "religious_moral_constraint": 0.48,
    "delegated_command_depth": 0.8245702934936714,
    "local_unit_autonomy": 0.821,
    "strategic_control_gap": 0.9005,
    "ceasefire_lag": 0.82
  }
}