{
  "scenario_name": "policy_minimum_brake_package",
  "description": "Illustrative governance overlay representing the combined partial restoration of multiple braking mechanisms under the same broad crisis frame.",
  "seed": 20260421,
  "peak_stress": 0.7999721678974817,
  "archetype": "rapid_shock_plateau",
  "regime": "",
  "governance_profile": {
    "platform_dependency": 0.52
  },
  "core": {
    "intelligence_reliability_gap": 0.805,
    "info_distortion": 0.752,
    "intelligence_contamination": 0.701,
    "negotiation_credibility": 0.34,
    "congressional_constraint": 0.495,
    "legal_cohesion": 0.595,
    "religious_moral_constraint": 0.53,
    "delegated_command_depth": 0.81,
    "local_unit_autonomy": 0.8,
    "strategic_control_gap": 0.9005,
    "ceasefire_lag": 0.82
  }
}